,paper_id,sentence,forecite_concepts,is_relational,relation,formatted_statement,concept_a,concept_b,is_conceptb_forecite
493,192628427.0,"pointnet\+\+ is the successor of pointnet, which had issues if applied on data with a non-consistent point density. pointnet\+\+ addresses this problem by extracting spherical point neighborhoods and applying pointnet on each hierarchical level.","{'pointnet\+\+', 'pointnet'}",1.0,based-on,pointnet\+\+ is based on pointnet.,pointnet\+\+,pointnet,yes
494,4556070.0,"this paper introduces a new open source platform for end-toend speech processing named espnet. espnet mainly focuses on end-to-end automatic speech recognition (asr), and adopts widely-used dynamic neural network toolkits, chainer and pytorch, as a main deep learning engine.",{'espnet'},1.0,used-for,espnet is used for end-toend speech processing.,espnet,end-toend speech processing,no
495,,,,,part-of,chainer is part-of espnet.,chainer,espnet,yes
496,,,,,part-of,pytorch is part-of espnet.,pytorch,espnet,yes
497,,,,,compare,"chianer is like pytorch, in that both are widely-used dynamic neural network toolkits.",pytorch,chainer,yes
498,4556070.0,"espnet mainly focuses on end-to-end automatic speech recognition (asr), and adopts widely-used dynamic neural network toolkits, chainer and pytorch, as a main deep learning engine. espnet also follows the kaldi asr toolkit style for data processing, feature extraction/format, and recipes to provide a complete setup for speech recognition and other speech processing experiments.","{'espnet', 'pytorch', 'chainer'}",1.0,part-of,chainer is part-of espnet.,chainer,espnet,yes
499,,,,,part-of,pytorch is part-of espnet.,pytorch,espnet,yes
500,,,,,compare,"chianer is like pytorch, in that both are widely-used dynamic neural network toolkits.",pytorch,chainer,yes
501,,,,,based-on,"espnet is based on the kaldi asr toolkit style for data processing, feature extraction/format, and recipes.",espnet,"the kaldi asr toolkit style for data processing, feature extraction/format, and recipes",no
502,4556070.0,"espnet also follows the kaldi asr toolkit style for data processing, feature extraction/format, and recipes to provide a complete setup for speech recognition and other speech processing experiments. this paper explains a major architecture of this software platform, several important functionalities, which differentiate espnet from other open source asr toolkits, and experimental results with major asr benchmarks.",{'espnet'},1.0,based-on,"espnet is based on the kaldi asr toolkit style for data processing, feature extraction/format, and recipes.",espnet,"the kaldi asr toolkit style for data processing, feature extraction/format, and recipes",no
503,4556070.0,"especially, these efforts have been driven by popular products including google voice search, amazon alexa, and apple siri and open source activities including kaldi [1] , htk [2] , sphinx [3] , julius [4] , rasr [5] in addition to general research activities. these open source toolkits include feature extraction, acoustic modeling based on a hidden markov model (hmm), gaussian mixture model, and deep neural network (dnn), and decoding 1 , and these enable us to use a full set of state-of-the-art asr research and development achievement.",{'kaldi'},1.0,compare,"kaldi is like to [htk, sphinx , julius, rasr], in that they are open source activities.",kaldi,"[htk, sphinx , julius, rasr]",no
504,,,,,type-of,acoustic modeling is a type-of open source toolkit.,acoustic modeling,open source toolkit,no
505,,,,,based-on,acoustic modeling is based on hidden markov mode.,acoustic modeling,hidden markov mode,no
506,4556070.0,"this paper describes a new open source toolkit named espnet (end-to-end speech processing toolkit), which aims to provide a neural end-to-end platform for asr and other speech processing. unlike the above open source tools based on hybrid dnn/hmm architecutres [7] , espnet provides a single neural network architecture to perform speech recognition in an end-to-end manner.",{'espnet'},1.0,type-of,espnet is a type of open source toolkit.,espnet,open source toolkit,no
507,,,,,used-for,espnet is used to perform speech recognition in an end-to-end manner.,espnet,perform speech recognition in an end-to-end manner,no
508,4556070.0,"unlike the above open source tools based on hybrid dnn/hmm architecutres [7] , espnet provides a single neural network architecture to perform speech recognition in an end-to-end manner. espnet adopts widely-used dynamic neural network toolkits, chainer [8] and pytorch [9] , as a main deep learning engine.",{'espnet'},1.0,used-for,espnet is used to perform speech recognition in an end-to-end manner.,espnet,perform speech recognition in an end-to-end manner,no
509,,,,,part-of,chainer is part-of espnet.,espnet,chainer,yes
510,4556070.0,"espnet adopts widely-used dynamic neural network toolkits, chainer [8] and pytorch [9] , as a main deep learning engine. espnet also follows the style of kaldi asr toolkit [1] for data processing, feature extraction/format, and recipes to provide a complete setup for speech recognition and other speech processing experiments.","{'espnet', 'chainer'}",1.0,part-of,chainer is part-of espnet.,espnet,chainer,yes
511,,,,,based-on,"espnet based on the style of kaldi asr toolkit [1] for data processing, feature extraction/format, and recipes.",espnet,"the style of kaldi asr toolkit [1] for data processing, feature extraction/format, and recipes",no
512,,,,,used-for,espnet used-for speech recognition and other speech processing experiments.,espnet,speech recognition and other speech processing experiments.,no
513,4556070.0,"espnet fully utilizes benefits of two major end-to-end asr implementations based on both connectionist temporal classification (ctc) [10, 11, 12] and attention-based encoder-decoder 1 language modeling is often performed by external language model toolkits, for example srilm [6] network [13, 14, 15, 16] . attention-based methods use an attention mechanism to perform alignment between acoustic frames and recognized symbols, while ctc uses markov assumptions to efficiently solve sequential problems by dynamic programming.",{'espnet'},1.0,part-of,attention mechanisms are part of attention-based methods.,attention mechanism,attention-based methods,no
514,,,,,used-for,attention mechanisms are used to perform alignment between acoustic frames and recognized symbols.,attention mechanism,perform alignment between acoustic frames and recognized symbols,no
515,4556070.0,"attention-based methods use an attention mechanism to perform alignment between acoustic frames and recognized symbols, while ctc uses markov assumptions to efficiently solve sequential problems by dynamic programming. espnet adopts hybrid ctc/attention end-to-end asr [17] , which effectively utilizes the advantages of both architectures in training and decoding.",{'attention mechanism'},1.0,part-of,attention mechanisms are part of attention-based methods.,attention mechanism,attention-based methods,no
516,,,,,used-for,attention mechanisms are used to perform alignment between acoustic frames and recognized symbols.,attention mechanism,perform alignment between acoustic frames and recognized symbols,no
517,4556070.0,"with these state-of-theart end-to-end asr techniques, espnet also provides a number of recipes for major asr benchmarks including wall street journal (wsj) [18] , librispeech [19] , ted-lium",{'espnet'},1.0,type-of,ted - lium is a type of asr benchmark.,ted - lium,asr benchmark,no
518,,,,,compare,"ted - lium is like [wall street journal (wsj), librispeech], in that they are asr benchmarks.",ted - lium,"[wall street journal (wsj), librispeech]",no
519,899695.0,"when allocating cluster resources, slaq explores the quality-runtime trade-offs across multiple jobs to maximize system-wide quality improvement. to do so, slaq leverages the iterative nature of ml training algorithms, by collecting quality and resource usage information from concurrent jobs, and then generating highlytailored quality-improvement predictions for future iterations.",{'slaq'},0.0,,,,,
520,899695.0,"to do so, slaq leverages the iterative nature of ml training algorithms, by collecting quality and resource usage information from concurrent jobs, and then generating highlytailored quality-improvement predictions for future iterations. experiments show that slaq achieves an average quality improvement of up to 73% and an average delay reduction of up to 44% on a large set of ml training jobs, compared to resource fairness schedulers.",{'slaq'},1.0,compare,slaq is an alternative to resource fairness schedulers in that slaq achieves an average quality improvement of up to 73% and an average delay reduction of up to 44% on a large set of ml training jobs.,slaq,resource fairness schedulers,no
521,899695.0,"we present slaq, a cluster scheduling system for ml training jobs that aims to maximize the overall job quality. slaq dynamically allocates resources based on job resource demands, intermediate model quality, and the system's workload.",{'slaq'},1.0,is-a,slaq is a cluster scheduling system for ml training jobs that aims to maximize the overall job quality.,slaq,cluster scheduling system for ml training jobs that aims to maximize the overall job quality,no
522,899695.0,"slaq dynamically allocates resources based on job resource demands, intermediate model quality, and the system's workload. the intuition behind slaq is that in the context of approximate ml training, more resources should be allocated to jobs that have the most potential for quality improvement.",{'slaq'},0.0,,,,,
523,899695.0,"slaq leverages the fact that most ml training algorithms are implemented as an iterative optimization process. by continually monitoring the history of quality improvement and runtime, slaq generates highlytailored and accurate quality predictions for future training iterations.",{'slaq'},0.0,,,,,
524,899695.0,"by continually monitoring the history of quality improvement and runtime, slaq generates highlytailored and accurate quality predictions for future training iterations. slaq estimates the impact of resource allocation on model quality, and explores the qualityruntime trade-offs across multiple jobs.",{'slaq'},0.0,,,,,
525,899695.0,"slaq estimates the impact of resource allocation on model quality, and explores the qualityruntime trade-offs across multiple jobs. based on this information, slaq adjusts their resource allocations of all running jobs to best utilize the limited cluster resources.",{'slaq'},0.0,,,,,
526,899695.0,slaq uses online prediction: it predicts the time and quality of the coming iterations based on statistics collected from previous iterations. slaq supports configurable high-level goals when scheduling jobs.,{'slaq'},0.0,,,,,
527,899695.0,"when maximizing the minimum quality, slaq can achieve the equivalent of max-min fairness applied to quality (rather than resource allocation). while we designed our scheduler for ml training applications, slaq can schedule many applications with approximate intermediate results.",{'slaq'},0.0,,,,,
528,899695.0,"we implemented slaq as a new scheduler within the apache spark framework [19] . slaq can use its qualitydriven scheduling for many of the ml algorithms available in mllib [5] , spark's machine learning package.",{'slaq'},1.0,is-a,mllib is spark's machine learning package.,mllib,spark's machine learning package,no
529,899695.0,"slaq can use its qualitydriven scheduling for many of the ml algorithms available in mllib [5] , spark's machine learning package. in fact, slaq supports unmodified ml applications using existing mllib optimizers, as well as applications using new optimization algorithms with only minor modifications.","{'mllib', 'slaq'}",1.0,is-a,mllib is spark's machine learning package.,mllib,spark's machine learning package,no
530,899695.0,slaq is designed for ml training in general exploratory settings on multi-tenant clusters. automated model search systems could work in conjuction with slaq for faster decisions and better cluster utilization.,{'slaq'},0.0,,,,,
531,24033213.0,"in this paper, we propose a convolutional neural network (cnn) model for solving geometric pattern recognition problems. the cnn receives as input multiple ordered input images and outputs the next image according to the pattern.",{'convolutional neural network'},0.0,,,,,
532,24033213.0,"the cnn receives as input multiple ordered input images and outputs the next image according to the pattern. our cnn is able to solve problems involving rotation, reflection, color, size and shape patterns and score within the top 5% of human performance.",{'cnn'},0.0,,,,,
533,24033213.0,"our architecture uses convolutional neural networks (cnns) (lecun et al. 1990 ). for multiple choice type problems, we use a classification architecture containing a discriminator (see e.g. (krizhevsky, sutskever, and hinton 2012) ).","{'convolutional neural network', 'cnn'}",0.0,,,,,
534,12575862.0,"community detection has attracted increasing attention during the past decade, and many algorithms have been proposed to find the underlying community structure in a given network. many of these algorithms are based on modularity maximization, and these methods suffer from the resolution limit.",{'community detection'},0.0,,,,,
535,12575862.0,"many of these algorithms are based on modularity maximization, and these methods suffer from the resolution limit. in order to detect the underlying cluster structure, we propose a new convex formulation to decompose a partially observed adjacency matrix of a network into low-rank and sparse components.",{'modularity maximization'},0.0,,,,,
536,12575862.0,"although this is not always true, it has formed the motivation for developing many algorithms based on modularity maximization [9] . modularity maximization is an npcomplete problem [6] and the algorithms are only able to find a good approximation to the global solution.",{'modularity maximization'},1.0,type-of,modularity maximization is a type of npcomplete problem.,modularity maximization,npcomplete problem,no
537,12575862.0,"we will discuss this property in more detail in the next section, and develop an alternating direction method of multipliers (admm) algorithm for the proposed model. finally, in section 3, we first discuss how to generate a random family of networks for which modularity maximization fails, then compare our results with those generated by louvain method [4] , which is a greedy algorithm to solve the modularity maximization problem.","{'admm', 'alternate direction method'}",0.0,,,,,
538,11589076.0,"as a result, cache-oblivious search trees have been suggested in the literature. in this paper, we present a new locality measure that can be used to derive cache-oblivious data structures.",{'cache - oblivious search tree'},0.0,,,,,
539,13144767.0,"the fact that the hidden layer is not touched after initialization and training consists of solving a linear system, makes the elm very fast compared to other learning methods based on for example backpropagation or gradient-descent [1, 2] . however, an aspect of the elm that has not received much attention so far is how to exactly initialize the hidden layer.",{'elm'},0.0,,,,,
540,13144767.0,"section 2 of the paper discusses the background and theory of elm, and gives a short overview of elm variants as well as preliminaries and methods relevant for this paper. in particular, it is discussed how to perform efficient model selection and optimization of the l2 regularization parameter in elm, which is important for training robust models.",{'elm'},0.0,,,,,
541,13144767.0,"the main idea behind the elm is the fact that theoretically it is sufficient to generate the hidden layer weights in a random way. as long as the weights are independent and the transfer functions are infinitely differentiable [1, 2] the elm is a universal approximator and can approximate any function, given enough data and given enough neurons.",{'elm'},1.0,is-a,"elm is a universal approximator and can approximate any function, given enough data and given enough neurons.",elm,universal approximator,no
542,13144767.0,"furthermore, combined with bip pretraining (which essentially makes the elm insensitive to the initial jwj and jxj), any difference between elms that only differ in the way they generate the weights, will have to come from the diversity of cos ; and hence the angles between the weights and the input data. finally, since the only thing that is adapted in the binary and ternary weight scheme is the way to generate the random weights, the computational time of the elm is not affected compared to the traditional random weights, and any advantages that may result from the different weight generation scheme will come for free.",{'elm'},0.0,,,,,
543,190001673.0,"in particular, each node only attends to its neighbors in gats whereas ag-gcns measure the relatedness among all nodes. the network topology in gats remains the same, while fully connected graphs will be built in ag-gcns to capture long-range semantic interactions.",{'gat'},1.0,compare,gats is like ag-gcns except that each node only attends to its neighbors.,gats,ag-gcns,no
544,198147929.0,[26] proposed a multi-scale auto-encoder network with both gradient difference loss and adversarial loss. prednet [24] is inspired by the concept of predictive coding from the neuroscience literature.,{'adversarial loss'},1.0,is-a,prednet is a method inspired by the concept of predictive coding from neuroscience literature.,prednet,method inspired by the concept of predictive coding from neuroscience literature,no
545,198147929.0,[42] proposed a convolutional network which offered a method to obtain time-series information between images and srivastava et al. [33] demonstrated that long short-term memory was able to capture pixellevel dynamics by conducting a sequence-to-sequence model.,{'convolutional network'},1.0,used-for,long short-term memory is used to capture pixellevel dynamics by conducting a sequence-to-sequence model.,long short-term memory,capture pixellevel dynamics by conducting a sequence-to-sequence model,no
546,,,,,is-a,convolutional network is a method used to obtain time-series information between images.,convolutional network,method used to obtain time-series information between images,no
547,115126.0,"it was observed in [gk11, brs11] that the snowflake of a finite metric space in l 2 may be embedded in dimension which is close to the intrinsic dimension of the space (measured by its doubling dimension), and this may be independent of n. in [gk11] the case of l 1 was considered as well, however the resulting dimension had doubly exponential dependence on the doubling dimension.",{'doubling dimension'},1.0,is-a,doubling dimension is a measure of the intrinsic dimension of a finite metric space. ,doubling dimension,measure of the intrinsic dimension of a finite metric space ,no
548,115126.0,"in [gk11] the case of l 1 was considered as well, however the resulting dimension had doubly exponential dependence on the doubling dimension. we demonstrate that the basic embedding can be used to build a snowflake for  p for all 1  p  2 with dimension polynomial in the doubling dimension; this is found in lemma 4.4.",{'doubling dimension'},0.0,,,,,
549,115126.0,"indyk [ind06] devised an analogue to the jl-lemma which uses p-stable distributions to produce estimates of interpoint distances; strictly speaking, this is not an embedding into  p (e.g. it uses median over the coordinates). motivated by the nearest neighbor search problem, indyk and naor [in07] proposed a weaker form of dimension reduction, and showed that every doubling subset s   2 admits this type of dimension reduction into  2 of dimension o(ddim(s)).",{'p - stable distribution'},1.0,used-for,p-stable distributions are used to produce estimates of interpoint distances by an analogue to the jl-lemma.,p-stable distributions,produce estimates of interpoint distances by an analogue to the jl-lemma,no
550,115126.0,"it was observed in [gk11, brs11] that the snowflake of a finite metric space in l 2 may be embedded in dimension which is close to the intrinsic dimension of the space (measured by its doubling dimension), and this may be independent of n. in [gk11] the case of l 1 was considered as well, however the resulting dimension had doubly exponential dependence on the doubling dimension.",{'doubling dimension'},1.0,is-a,doubling dimension is a measure of the intrinsic dimension of a finite metric space. ,doubling dimension,measure of the intrinsic dimension of a finite metric space ,no
551,115126.0,"in [gk11] the case of l 1 was considered as well, however the resulting dimension had doubly exponential dependence on the doubling dimension. we demonstrate that the basic embedding can be used to build a snowflake for  p for all 1  p  2 with dimension polynomial in the doubling dimension; this is found in lemma 4.4.",{'doubling dimension'},0.0,,,,,
552,115126.0,"indyk [ind06] devised an analogue to the jl-lemma which uses p-stable distributions to produce estimates of interpoint distances; strictly speaking, this is not an embedding into  p (e.g. it uses median over the coordinates). motivated by the nearest neighbor search problem, indyk and naor [in07] proposed a weaker form of dimension reduction, and showed that every doubling subset s   2 admits this type of dimension reduction into  2 of dimension o(ddim(s)).",{'p - stable distribution'},1.0,used-for,p-stable distributions are used to produce estimates of interpoint distances by an analogue to the jl-lemma.,p-stable distributions,produce estimates of interpoint distances by an analogue to the jl-lemma,no
553,22688536.0,"a software product line for m-learning focusing on programming is discussed in [59] and a software product line for games is presented in [60] . recently, researchers have expressed e-learning processes using software product lines [61] .",{'software product line'},1.0,used-for,software product lines are used to express e-learning processes.,software product lines,express e-learning processes,no
554,4939967.0,"their framework is based on a genetic algorithm which generates test suites for mutation testing. to maximize the mutation score of a test suite, the proposed genetic algorithm needs to execute ws-bpel programs under test many times, which is very timeconsuming and thus not efficient.",{'mutation testing'},0.0,,,,,
555,207212496.0,"in this framework, the magnetization-prepared two rapid acquisition gradient echoes (mp2rage) (marques et al., 2010; marques and gruetter, 2013) was developed as an extension of the mprage (mugler and brookeman, 1990) , one of the most common mr sequence used for anatomical t 1 -weighted imaging. mp2rage not only provides a so-called ""uniform"" t 1 -weighted image suitable for morphological analysis, but is also a fast t 1 mapping sequence, recently used to investigate the healthy cervical sc at 3t (rasoanandrianina et al., 2019) and at 7t (massire et al., 2016 ).",{'mp2rage'},1.0,is-a,mp2rage is an extension of the mprage.,mp2rage,extension of the mprage,no
556,,,,,is-a,"mp2rage is a fast t 1 mapping sequence that provides a so-called ""uniform"" t 1 -weighted image suitable for morphological analysis.",mp2rage,"fast t 1 mapping sequence that provides a so-called ""uniform"" t 1 -weighted image suitable for morphological analysis",no
557,,,,,used-for,mp2rage is used to investigate the healthy cervical sc at 3t and at 7t.,mp2rage,investigate the healthy cervical sc at 3t and at 7t,no
558,207212496.0,"mp2rage not only provides a so-called ""uniform"" t 1 -weighted image suitable for morphological analysis, but is also a fast t 1 mapping sequence, recently used to investigate the healthy cervical sc at 3t (rasoanandrianina et al., 2019) and at 7t (massire et al., 2016 ). mp2rage appears particularly well-suited for cervical sc uhf-imaging due to various assets, including: an adiabatic inversion radiofrequency pulse, robust gradient echo (gre) readouts, an overall low specific absorption rate (sar), an intrinsic volume co-registration and an overall immunity to b 1  bias (marques et al., 2010) .",{'mp2rage'},1.0,used-for,"mp2rage is used for cervical sc uhf-imaging due to various assets, including: an adiabatic inversion radiofrequency pulse, robust gradient echo (gre) readouts, an overall low specific absorption rate (sar), an intrinsic volume co-registration and an overall immunity to b 1 bias.",mp2rage,cervical sc uhf-imaging,no
559,2747778.0,"although the recent research challenge tempeval (uzzaman et al., 2013; bethard and savova, 2016) offers an evaluation in the clinical domain besides newswire, most participants used the provided annotated corpus to train supervised models in addition to employing hand-coded rules. previous work on adapting temporal taggers primarily focus on scaling up to more languages.",{'tempeval'},0.0,,,,,
560,2747778.0,"previous work on adapting temporal taggers primarily focus on scaling up to more languages. heideltime was extended to multilingual (strtgen and gertz, 2015) , collo-",{'temporal tagger'},0.0,,,,,
561,10022612.0,we detail a machine-checked proof of soundness of our separation logic. this is the first large-scale machine-checked proof of a separation logic w.r.t.,{'separation logic'},0.0,,,,,
562,56475910.0,"cnn architecture consists of several types of layers including convolution, pooling, and fully connected. the network expert has to make multiple choices while designing a cnn such as the number and ordering of layers, the hyperparameters for each type of layer (receptive field size, stride, etc.).",{'pooling'},1.0,type-of,pooling is a type of layer in cnn architecture.,pooling,layer,no
