,paper_id,sentence,forecite_concepts,is_relational,relation,formatted_statement,concept_a,concept_b,is_conceptb_forecite
0,12205351.0,"partially labeled lda (plda) extends labeled lda to incorporate per-label latent topics (ramage et al., 2011) . the df-lda model (andrzejewski et al., 2009 ) employs must-link and cannot-link constraints as dirichlet forest priors for lda learning, but it suffers the scalability issue.","{'plda', 'dirichlet forest prior'}",1.0,is-a,plda is a partially labeled lda that extends labeled lda to incorporate per-label latent topics.,plda,partially labeled lda,no
1,12205351.0,,,,compare,"plda is like the df-lda model, except plda extends labeled lda to incorporate per-label latent topics and df-lda employs must-link and cannot-link constraints as dirichlet forest priors for lda learning, but it suffers the scalability issue.",plda,the df-lda model,no
2,12205351.0,,,,used-for,dirichlet forest priors are used for lda learning that suffer the scalability issue when employed as must-link and cannot-link constraints in the df-lda model.,dirichlet forest prior,lda learning,no
3,12205351.0,"the df-lda model (andrzejewski et al., 2009 ) employs must-link and cannot-link constraints as dirichlet forest priors for lda learning, but it suffers the scalability issue. most recently, the aspect extraction model for sentiment analysis (mukherjee and liu, 2012) assumes that a seed set is given which consists of words together with their respective aspect category.","{'seed set', 'dirichlet forest prior'}",1.0,used-for,dirichlet forest priors are used for lda learning that suffer the scalability issue when employed as must-link and cannot-link constraints in the df-lda model.,dirichlet forest prior,lda learning,no
4,12205351.0,"most recently, the aspect extraction model for sentiment analysis (mukherjee and liu, 2012) assumes that a seed set is given which consists of words together with their respective aspect category. then depending on whether a word is a seed or non-seed word, a different route of multinomial distribution will be taken to emit the word.","{'seed set', 'multinomial distribution'}",1.0,is-a,a seed set is a set of words together with their respective aspect category that is assumed to be given in the aspect extraction model for sentiment analysis.,seed set,a set of words together with their respective aspect category,no
5,12205351.0,,,,part-of,"a seed set is a part of the aspect extraction model for sentiment analysis that is assumed to be given and depending on whether a word is a seed or non-seed word, a different route of multinomial distribution is taken to emit the word.",seed set,the aspect extraction model for sentiment analysis,no
6,12205351.0,,,,used-for,"multinomial distribution is used for the aspect extraction model for sentiment analysis that emits a word from a seed set, depending on whether a word is a seed or non-seed word.",multinomial distribution,the aspect extraction model for sentiment analysis,no
7,4905841.0,"changing user pseudonyms while the users pass through pre-defined spots, called mix zones [22] , makes it difficult to track the users along their trajectories. however, users must remain silent inside the mix zones, which means that they cannot use the lbs.",{'mix zone'},1.0,is-a,"mix zones are pre-defined spots that users pass through and must remain silent inside, which means that they cannot use the lbs.",mix zone,pre-defined spots,no
8,4905841.0,"however, users must remain silent inside the mix zones, which means that they cannot use the lbs. to mitigate this problem, the size of the mix zones is kept small, which in turn limits the unlinkability of users' queries.",{'mix zone'},0.0,,,,,
9,4905841.0,"to mitigate this problem, the size of the mix zones is kept small, which in turn limits the unlinkability of users' queries. even if the mix zones are optimally placed, the adversary's success is relatively high [23] .",{'mix zone'},0.0,,,,,
10,4905841.0,"in [24] , for example, the need to construct the cloaking regions and to receive the responses from the server through other users can considerably degrade the service. many obfuscation-based techniques are based on k-anonymity, which has been shown inadequate to protect privacy [8] , [25] .",{'cloaking region'},1.0,used-for,"k-anonymity is used for many obfuscation-based techniques, which has been shown inadequate to protect privacy.",k - anonymity,many obfuscation-based techniques,not
11,27044448.0,"epidemic routing introduced in [2] is an improvement of flooding based technique. in original form [2] , instead of passing information to all known neighbours, it uses information index (summary vector) exchange process to avoid sending the same information to same nodes.",{'epidemic routing'},1.0,is-a,"epidemic routing is an improvement of flooding based technique that in original form, instead of passing information to all known neighbours, it uses information index (summary vector) exchange process to avoid sending the same information to same nodes.",epidemic routing,improvement of flooding based technique,no
12,27044448.0,,,,is-a,summary vector is an information index exchange process that is used in the original form of flooding based technique to avoid sending the same information to same nodes.,summary vector,information index exchange process,no
13,53460604.0,"a well-known model aiming to explain and predict individual adoption and use of information technologies (it) is technology acceptance model (tam), developed and validated by davis [11] , and davis, bagozzi and warshaw [12] . tam has three key variables: perceived usefulness (pu), perceived ease of use (peou), and behavioural intention (bi) to use.",{'technology acceptance model'},1.0,is-a,"technology acceptance model is a well-known model aiming to explain and predict individual adoption and use of information technologies (it) that has three key variables: perceived usefulness (pu), perceived ease of use (peou), and behavioural intention (bi) to use.",technology acceptance model,a well-known model aiming to explain and predict individual adoption and use of information technologies (it),no
14,53460604.0,,,,part-of,perceive usefulness is a part of the technology acceptance model that is a key variable.,perceive usefulness,technology acceptance model,yes
15,53460604.0,,,,part-of,perceived ease of use is a part of the technology acceptance model that is a key variable.,perceive ease,technology acceptance model,yes
16,53460604.0,,,,is-a,perceive usefulness is a key variable of the technology acceptance model.,perceive usefulness,key variable of the technology acceptance model,no
17,53460604.0,,,,is-a,perceived ease of use is a key variable of the technology acceptance model.,perceive ease,key variable of the technology acceptance model,no
18,53460604.0,,,,compare,percieve usefulness is like perceived ease of use in that they are both key variables of the technology acceptance model.,perceive usefulness,perceive ease,yes
19,17360106.0,"in face detectors and similar classifiers, haar-like wavelets [3] , [8] , [9] , [10] are frequently used, since they provide good amount of discriminative information and they provide excellent performance. other features are used in different contexts, such as the local binary patterns [5] .",{'face detector'},1.0,is-a,"face detectors are a classifier that frequently uses haar-like wavelets, since they provide good amount of discriminative information and they provide excellent performance.",face detector,classifier,no
20,17360106.0,,,,is-a,local binary patterns are a feature used in face detectors and similar classifiers.,local binary pattern,feature used in face detectors and similar classifiers,no
21,17360106.0,,,,compare,local binary patterns are an alternative to haar-like wavelets in that they are features used in different contexts for face detectors and similar classifiers.,local binary pattern,haar-like wavelets,no
22,403627.0,"therefore, the computational goal is to estimate an ideal binary mask which selects t-f units where the target energy dominates [1] . such ideal binary masks have been shown to be effective front-ends for robust automatic speech recognition [2] [3] and to provide speech intelligibility improvements for normal listeners under noisy conditions [3] .",{'ideal binary mask'},1.0,used-for,ideal binary masks are used to select t-f units where the target energy dominates.,ideal binary mask,select t-f units where the target energy dominates,no
23,403627.0,,,,is-a,ideal binary masks are effective front-ends for robust automatic speech recognition that provide speech intelligibility improvements for normal listeners under noisy conditions.,ideal binary mask,effective front-ends for robust automatic speech recognition,no
24,10213642.0,"remark that this approach assumes that an edit path may be deduced from a sequence of edit operations applied on nodes only. as we will see in this paper, this is possible because there is an equivalence relation between assignments and edit paths.",{'edit path'},0.0,,,,,
25,10213642.0,"more generally, any mapping between the nodes of two graphs induces an edit path which substitutes all mapped nodes together with all their incident edges, and inserts or removes the non-mapped nodes/edges. conversely, given an edit path between two graphs, such that each node and each edge is substituted only once, one can define a mapping between the substituted nodes and edges of both graphs.",{'edit path'},1.0,is-a,"an edit path is any mapping between the nodes of two graphs, which substitutes all mapped nodes together with all their incident edges, and inserts or removes the non-mapped nodes/edges. ",edit path,any mapping between the nodes of two graphs,no
26,189927804.0,"recently, hashing methods have been widely used in ann search. they usually learn a hamming space which is refined to maintain similarity between features song et al., 2018c;",{'hashing method'},1.0,used-for,hashing methods are used in ann search to usually learn a hamming space which is refined to maintain similarity between features.,hashing method,ann search,no
27,189927804.0,,,,based-on,"a hamming space is based on hashing methods, that is refined to maintain similarity between features in ann search.",hamming space,hashing method,yes
28,189927804.0,"since the computation of hamming distance is super fast, hashing methods have huge advantages on ann search. however, hashing methods lack accuracy on feature restoration.",{'hashing method'},1.0,used-for,"hashing methods are methods used for ann search that have huge advantages since the computation of hamming distance is super fast, but they lack accuracy on feature restoration. ",hashing method,method,no
29,189927804.0,"deep visual-semantic quantization [cao et al., 2017] and deep triplet quantization quantize features by cq. different from these works, deep product quantization [klein and wolf, 2017] , product quantization network [yu et al., 2018b] and generative adversarial product quantization [yu et al., 2018a] of neural network, so that gradient descent can be applied to quantization.",{'deep visual - semantic quantization'},1.0,compare,deep visual-semantic quantization is like deep triplet quantization in that they quantize features by cq.,deep visual - semantic quantization,deep triplet quantization,no
30,189927804.0,,,,compare,"product quantization network is an alternative to [deep visual-semantic quantization, deep triplet quantization], that can apply gradient descent to quantization.",product quantization network,"deep visual-semantic quantization, deep triplet quantization",yes
31,189927804.0,,,,compare,"product quantization network is like [deep product quantization, generative adversarial product quantization of neural network] in that they can apply gradient descent to quantization.",product quantization network,"deep product quantization, generative adversarial product quantization of neural network",no
32,59368612.0,"existing researches have proved that mouse dynamics are more effective in authenticating users in real time. existing researches about mouse dynamics have some common shortages: most of them need more than five international workshop on cloud computing and information security (ccis 2013) minutes to authenticate, some of them can only get satisfactory experimental result in a fixed application and some others ask the users to do some operations for a long time like playing a memory games.",{'mouse dynamic'},1.0,used-for,mouse dynamics are used for authenticating users in real time.,mouse dynamic,authenticating users in real time,no
33,5686072.0,"in the midst of this trend, computational thinking (ct) has quickly become a prerequisite skill for many endeavors of the 21st century [wing 2008 ]. computational thinking has a long history within computer science, dating back to the 1950s and 1960s, when it was labeled as ""algorithmic thinking"" [denning 2009 ].",{'computational thinking'},1.0,is-a,"computational thinking (ct) is a prerequisite skill for many endeavors of the 21st century that has a long history within computer science, dating back to the 1950s and 1960s, when it was labeled as ""algorithmic thinking"".",computational thinking,prerequisite skill for many endeavors of the 21st century,no
34,5686072.0,"similarly, computational thinking could be applied to language arts by having students do linguistic analysis of sentences and identifying and representing patterns for different sentence structures. computational thinking also has the potential to foster creativity in the classroom by allowing students to move from consumers of technology to building tools that benefit society [mishra et al. 2013] .",{'computational thinking'},1.0,used-for,computational thinking could be used for language arts by having students do linguistic analysis of sentences and identifying and representing patterns for different sentence structures.,computational thinking,language arts,no
35,5686072.0,,,,used-for,computational thinking could be used to foster creativity in the classroom by allowing students to move from consumers of technology to building tools that benefit society.,computational thinking,foster creativity in the classroom,no
36,5686072.0,"wing advocated the necessity of computational thinking in k-12 education by stating, ""to reading, writing, and arithmetic, we should add computational thinking to every child's analytical ability"" [wing 2006, p. 33] . a recent report on computational thinking by the national council for research advanced a similar idea: ct is a cognitive skill that an average person is expected to possess [nrc 2010 ].",{'computational thinking'},1.0,part-of,"computational thinking is a part of k-12 education that should be added to every child's analytical ability for reading, writing, and arithmetic.",computational thinking,k-12 education,no
37,5686072.0,,,,is-a,computational thinking is a cognitive skill that an average person is expected to posses based on a recent report by the national council for research.,computational thinking,cognitive skill,no
38,5686072.0,"a recent report on computational thinking by the national council for research advanced a similar idea: ct is a cognitive skill that an average person is expected to possess [nrc 2010 ]. the nrc report highlighted ""(1) that students can learn thinking strategies such as computational thinking as they study a discipline, (2) that teachers and curricula can model these strategies for students, and (3) that appropriate guidance can enable students to learn to use these strategies independently"" (p. 62).",{'computational thinking'},1.0,is-a,"computational thinking is a thinking strategy that students can learn as they study a discipline, teachers and curricula can model for students, and that appropriate guidance can enable students to learn independently.",computational thinking,thinking strategy,no
39,46821682.0,we formalize the concept of probabilistic movement primitives (promps) as a general probabilistic framework for representing and learning mps. a promp represents a distribution over trajectories.,{'probabilistic movement primitive'},1.0,is-a,probabilistic movement primitives (promps) is a general probabilistic framework for representing and learning mps that represents a distribution over trajectories.,probabilistic movement primitive,general probabilistic framework for representing and learning mps,no
40,46821682.0,"in this paper, we unify and complement our prior work [33, 36, 37] on promps. note that the reference [33] contains only a brief summary of our work on promps presented in the context of an overview paper that spans over multiple topics.",{'promp'},0.0,,,,,
41,5260346.0,"it was first proposed for lexicalized tree adjoining grammar (ltag) (bangalore and joshi, 1999) , then extended to combinatory categorial grammar (ccg) (clark, 2002) and head-driven phrase structure grammar (hpsg)",{'combinatory categorial grammar'},0.0,,,,,
42,5260346.0,"in practice, the multi-tagging technique proposed by clark (2002) assigned more than one supertag to each word and let the ambiguous supertags be selected by the parser. as for other nlp applications which use supertags, resolving more supertag ambiguities in supertagging stage is preferred.",{'supertag'},1.0,used-for,supertags are used for the multi-tagging technique that assigns more than one supertag to each word and lets the ambiguous supertags be selected by the parser.,supertag,the multi-tagging technique,no
43,5260346.0,,,,used-for,"supertags are used for nlp applications other than the multi-tagging technique, that prefer resolving more supertag ambiguities in supertagging stage.",supertag,nlp applications other than the multi-tagging technique,no
44,204960759.0,"thompson sampling is an efficient algorithm for sequential decision making, which exploits the posterior uncertainty to solve the exploration-exploitation dilemma. there has been significant recent interest in integrating bayesian neural networks into thompson sampling.",{'thompson sampling'},1.0,used-for,"thompson sampling is an efficient algorithm for sequential decision making, that exploits the posterior uncertainty to solve the exploration-exploitation dilemma.",thompson sampling,efficient algorithm for sequential decision making,no
45,204960759.0,,,,used-for,bayesian neural networks can be used for thompson sampling.,bayesian neural network,thompson sampling,no
46,204960759.0,"variational inference is used to approximate the posterior of the local variable, and semi-implicit structure is further introduced to enhance its expressiveness. our experimental results on eight contextual bandits benchmark datasets show that thompson sampling guided by local uncertainty achieves state-of-the-art performance while having low computational complexity.",{'variational inference'},1.0,used-for,variational inference is used to approximate the posterior of the local variable.,variational inference,approximate the posterior of the local variable,no
47,204960759.0,"therefore, significant effort has been dedicated to posterior approximation. a recent development along this direction is empowering ts with bayesian neural networks (hinton & van camp, 1993; bishop, 2006; graves, 2011; neal, 2012; hernndez-lobato & adams, 2015) , and relying on the posteriors of the neural network weights to perform exploration under the ts framework (riquelme et al., 2018) .",{'posterior approximation'},0.0,,,,,
48,17927373.0,we investigate the problem of secure communications in a gaussian multiway relay channel applying the compute-and-forward scheme under usage of nested lattice codes. all nodes employ half-duplex operation and can exchange confidential messages only via an untrusted relay.,{'compute - - forward scheme'},0.0,,,,,
49,56003001.0,"in this paper we analyze different aspects related to the use of twitter in different national meteorological services (nms) worldwide. firstly, we will review the general position of nms worldwide regarding the use of twitter technology.",{'nms'},0.0,,,,,
50,56003001.0,"as a consequence many nms have developed new communication strategies and incorporated this tool for different purposes. some nms do not only provide forecast and other remarkable information routinely, but gives real-time observed data, forecast and relevant information continuously before and during severe-weather episodes, as in the basque meteorology service (euskalmet) case (gaztelumendi et al., 2013a) .",{'nms'},1.0,is-a,"nms is a tool that can not only provide forecast and other remarkable information routinely, but gives real-time observed data, forecast and relevant information continuously before and during severe-weather episodes, as in the basque meteorology service.",nms,tool,no
51,10351076.0,"this study develops an original and innovative matrix representation with respect to the information flow for networked multi-agent system. to begin with, the general concepts of the edge laplacian of digraph are proposed with its algebraic properties.",{'networked multi - agent system'},0.0,,,,,
52,10351076.0,"to begin with, the general concepts of the edge laplacian of digraph are proposed with its algebraic properties. benefit from this novel graph-theoretic tool, we can build a bridge between the consensus problem and the edge agreement problem; we also show that the edge laplacian sheds a new light on solving the leaderless consensus problem.",{'edge laplacian'},1.0,is-a,edge laplacian of digraph is a novel graph-theoretic tool that can build a bridge between the consensus problem and the edge agreement problem and sheds a new light on solving the leaderless consensus problem.,edge laplacian,novel graph-theoretic tool,no
53,10351076.0,"first, the edge laplacian of digraph is proposed as well as the edge adjacency matrix. comparing to our previous works [35] , much more details about the algebraic properties of the edge laplacian are explored.",{'edge laplacian'},0.0,,,,,
54,10351076.0,"comparing to our previous works [35] , much more details about the algebraic properties of the edge laplacian are explored. as a matter of fact, the invertibility of the incidence matrix and the spectra properties of the edge laplacian play a central role in the subsequent analysis.",{'edge laplacian'},0.0,,,,,
55,11387290.0,"random forest is an algorithm that uses an ensemble of classification trees, each of which is built using a bootstrap sample of the data, and at each split the candidate set of genes is a random subset of the genes. thus, random forest uses both bagging (bootstrap aggregation) and random variable selection for tree building.",{'random forest'},1.0,is-a,"random forest is an algorithm that uses an ensemble of classification trees, each of which is built using a bootstrap sample of the data, and at each split the candidate set of genes is a random subset of the genes. ",random forest,algorithm,no
56,11387290.0,,,,is-a,random forest is an algorithm that uses both bagging (bootstrap aggregation) and random variable selection for tree building.,random forest,algorithm,no
57,11387290.0,"thus, random forest uses both bagging (bootstrap aggregation) and random variable selection for tree building. each tree is unpruned to obtain low-bias trees; at the same time, bagging and random variable selection result in low correlation of the individual trees.",{'random forest'},1.0,is-a,bagging is a bootstrap aggregation that is used for tree building in random forests and results in low correlation of the individual trees.,bagging,bootstrap aggregation,no
58,11387290.0,,,,compare,bagging is like random variable selection in that they are used for tree building in random forests and result in low correlation of the individual trees.,bagging,random variable selection,no
59,6527365.0,"amr aims to abstract away from syntactic idiosyncrasies and attempts to capture only the core meaning of a sentence, which could potentially improve ddi extraction from sentences. two classifiers (support vector machine and random forest) taking these embedding features as input were evaluated on the ddiextraction 2013 challenge corpus.",{'ddi extraction'},1.0,is-a,random forest is a classifier that has taken embedding features as input to evaluate on the ddiextraction 2013 challenge corpus.,random forest,classifier,no
60,6527365.0,,,,compare,random forest is like support vector machine in that they are classifiers that have taken embedding features as input to evaluate on the ddiextraction 2013 challenge corpus.,random forest,support vector machine,no
61,6527365.0,"in this paper, we utilize dependency and amr embeddings as features for ddi extraction. we evaluate these embeddings on ddiextraction 2013 challenge corpus with two different classification methods: svm and random forest.",{'ddi extraction'},1.0,is-a,random forest is a classification method that is evaluated on the ddiextraction 2013 challenge corpus.,random forest,classification method,no
62,6527365.0,,,,compare,random forest is like svm in that they are both classification methods that are evaluated on the ddiextraction 2013 challenge corpus.,random forest,svm,no
63,6527365.0,"in the next section, we briefly introduce the related work of used features for ddi extraction in the literature. in section 3, we describe the proposed methods for ddi extraction.",{'ddi extraction'},0.0,,,,,
