,paper_id,sentence,forecite_concepts,is_relational,relation,formatted_statement,concept_a,concept_b,is_conceptb_forecite
1042,10113401.0,"the speed is evaluated from the position of initial and final contour, change of curvature of initial contour to that of final contour and the optic flow vectors of image sequence as discussed in the next section. note that this curve evolution deforms level set function but does not process contour pixels individually as in active contour [6, 8] .",{'initial contour'},0.0,,,,,
1043,1490304.0,"in recent years, many studies have focused on sentiment classification in the context of machine learning, e.g. to identify that a sentiment is positive or negative. in particular, the bag-of-words method has been popularly used to transform textual data into structured data, in order to enable the direct use of machine learning algorithms for sentiment classification.",{'sentiment classification'},1.0,used-for,"sentiment classification is used for the context of machine learning, e.g. to identify that a sentiment is positive or negative.",sentiment classification,"the context of machine learning, e.g. to identify that a sentiment is positive or negative",no
1044,1490304.0,"in particular, concepts on fuzzy logic, rule based systems and sentiment classification are described. section iii proposes the use of fuzzy rule based systems towards advances in interpretability of computational models for sentiment classification.",{'sentiment classification'},0.0,,,,,
1045,1490304.0,section iii proposes the use of fuzzy rule based systems towards advances in interpretability of computational models for sentiment classification. section iv reports an experimental study to show that fuzzy rule based systems can demonstrate similar or even better accuracy of sentiment classification.,{'sentiment classification'},0.0,,,,,
1046,5883271.0,"in this paper, we revisit the enumeration of directed animals using gas models. we show that there exists a natural construction of random directed animals on any directed graph together with a particles system -a gas model with nearest exclusion -that explains combinatorialy the formal link known between the density of the gas model and the generating function of directed animals counted according to the area.",{'gas model'},1.0,used-for,gas models are used for the enumeration of directed animals.,gas models,the enumeration of directed animals,no
1047,14276533.0,"[4] propose the lrr-graph, which seeks a low-rank representation of the data. by jointly obtaining the representation of all the data under the low-rankness assumption, lrr-graph effectively impose global constraints on the data structure (e.g., multiple subspaces).",{'low - rank representation'},1.0,used-for,"lrr-graph is used to impose global constraints on the data structure (e.g., multiple subspaces).",lrr-graph,"impose global constraints on the data structure (e.g., multiple subspaces)",no
1048,14276533.0,"in this paper, we demonstrate how the label information can be integrated into the construction of lrr-graph, resulting in significantly improvement on the performance of existing ssl methods. further, our framework can be readily applied to other self-representation methods such as 1 -graph, least squares representation [39] , correlation adaptive subspace segmentation [40] , correntropy induced 2 -graph [41] , and the smooth representation [42] .",{'lrr'},1.0,compare,"correlation adaptive subspace segmentation is like [1 -graph, least squares representation, correntropy induced 2 -graph, smooth representation] in that they are both self-representation methods.",correlation adaptive subspace segmentation,"1 -graph, least squares representation, correntropy induced 2 -graph, smooth representation",no
1049,,,,,is-a,correlation adaptive subspace segmentation is a self-representation method.,correlation adaptive subspace segmentation,self-representation method,no
1050,18173800.0,"more recently, reduction rules based on matching theory [28] or on bidimensionality theory [15] have been proposed. in this paper, we develop and push further a kernelization technique used for a few parameterized problems [9, 30] , called conflict packing, which also uses matching arguments.",{'bidimensionality theory'},,,,,,
1051,4012597.0,"a detailed discussion on the diversity order of relay selection for several practical channel estimation techniques is presented in section vi-c, and corresponding numerical examples are given in section vii. these results are based on the exact outage analysis conducted in section iv for rayleigh fading and certain channel estimation techniques, and are extended to nakagami-m fading in section v. prior to the outage analysis, the unified model that incorporates the effects of noisy and outdated channel estimates is presented in section iii.",{'diversity order'},,,,,,
1052,53230629.0,"therefore, in this article, we provide an overview of the current literature on publishing and consuming data on the web by conducting a systematic mapping study. systematic mapping is a protocol-driven methodology for reviewing and synthesizing a research data area [67] .",{'systematic mapping study'},,,,,,
1053,53230629.0,systematic mapping is a protocol-driven methodology for reviewing and synthesizing a research data area [67] . a systematic mapping study typically provides an overview of the research reported in the field and identifies possible issues arising from examining the existing literature.,{'systematic mapping'},,,,,,
1054,16314115.0,"it is known that by restricting the class of formulae it is possible to guarantee that a certain class of proofs, known as uniform proofs, are complete with respect to provability in intuitionistic logic. in this paper we explore the relationship between uniform proofs and classes of formulae more deeply.",{'uniform proof'},,,,,,
1055,16314115.0,in this paper we explore the relationship between uniform proofs and classes of formulae more deeply. firstly we show that uniform proofs arise naturally as a normal form for proofs in rst-order intuitionistic sequent calculus.,{'uniform proof'},1.0,type-of,uniform proofs are a type of normal form for proofs in rst-order intuitionistic sequent calculus.,uniform proof,normal form for proofs in rst-order intuitionistic sequent calculus,no
1056,16314115.0,"firstly we show that uniform proofs arise naturally as a normal form for proofs in rst-order intuitionistic sequent calculus. next we show that the class of formulae known as hereditary harrop formulae are intimately related to uniform proofs, and that we may extract such formulae from uniform proofs in two di erent ways.",{'uniform proof'},1.0,type-of,uniform proofs are a type of normal form for proofs in rst-order intuitionistic sequent calculus.,uniform proof,normal form for proofs in rst-order intuitionistic sequent calculus,no
1057,16314115.0,"next we show that the class of formulae known as hereditary harrop formulae are intimately related to uniform proofs, and that we may extract such formulae from uniform proofs in two di erent ways. we also give results which may be interpreted as showing that hereditary harrop formulae are the largest class of formulae for which uniform proofs are guaranteed to be complete, along the lines of an interpolation theorem.",{'uniform proof'},0.0,,,,,
1058,16314115.0,"a uniform proof is one in which the principal connective of the formula is introduced in the last step of the proof; in other words, when searching for a proof of a given formula, we need only consider the immediate subformulae of the desired conclusion. hence we may think of uniform proofs as goal-directed, in that when searching for a uniform proof of a given goal, we may use the structure of the goal to determine the structure of the proof.",{'uniform proof'},1.0,is-a,"a uniform proof is a proof that introduces the principal connective of the formula in the last step of the proof; in other words, when searching for a proof of a given formula, we need only consider the immediate subformulae of the desired conclusion. ",uniform proof,proof,no
1059,16314115.0,,,,is-a,"uniform proofs are goal-directed proofs, in that when searching for a uniform proof of a given goal, we may use the structure of the goal to determine the structure of the proof.",uniform proof,goal-directed proof,no
1060,16314115.0,"in this paper we examine the relationship between uniform proofs and hereditary harrop formulae, and we give several results which may be interpreted as establishing the maximality of this class of formulae. as uniformity is a property of proofs rather than formulae, it is not strictly possible to establish that a given class of formulae is the largest one for which uniform proofs are complete.",{'uniform proof'},0.0,,,,,
1061,16314115.0,"however, as we shall see, there is a natural relationship between uniform proofs and hereditary harrop formulae. essentially this is that whilst f 1 ; f`u f 2 , there is a hereditary harrop formula d such that d`u f 2 , and d is related to f and f 1 in such a way that d is the formula \doing the work"" in the uniform proof.",{'uniform proof'},1.0,compare,"uniform proofs are like hereditary harrop formulae, in that whilst f 1 ; f`u f 2 , there is a hereditary harrop formula d such that d`u f 2 , and d is related to f and f 1 in such a way that d is the formula \doing the work"" in the uniform proof.",uniform proof,hereditary harrop formula,yes
1062,16314115.0,this occurs by determining when it is possible to permute certain combinations of inference rules so that an arbitrary proof may be converted into a uniform proof. thus we may identify hereditary harrop formulae as a logic programming language purely from the notion of a uniform proof and the proof theory of intuitionistic logic; no prior knowledge of logic programming languages per se is needed.,{'uniform proof'},0.0,,,,,
1063,16314115.0,thus we may identify hereditary harrop formulae as a logic programming language purely from the notion of a uniform proof and the proof theory of intuitionistic logic; no prior knowledge of logic programming languages per se is needed. this suggests that the strategy of studying permutation rules in order to investigate the completeness of goal-directed provability may be used to identify logic programming languages independently of the logic in use; such a strategy has been used to identify logic programming languages in linear logic 8;9),{'uniform proof'},0.0,,,,,
1064,30147060.0,"hitag2 is an encryption algorithm designed by nxp semiconductors that is used in electronic vehicle immobilizers and anti-theft devices. hitag2 uses 48-bit keys for authentication and confidentiality, and due to that feature it is considered an insecure cipher.",{'hitag2'},1.0,is-a,"hitag2 is an encryption algorithm that is designed by nxp semiconductors, used in electronic vehicle immobilizers and anti-theft devices, and uses 48-bit keys for authentication and confidentiality.",hitag2,encryption algorithm,no
1065,30147060.0,,,,type-of,hitag2 is a type of insecure cipher in that it uses 48-bit keys for authentication and confidentiality.,hitag2,insecure cipher,no
1066,30147060.0,"in this contribution, we have focused on the usage of hitag2 as a pke system in a publicly known protocol (verdult et al., 2012) . given the short length of hitag2's keys, this stream cipher has been considered insecure for some years, and as such it can be attacked by using expensive devices such as copacobana (guneysu et al., 2008) .",{'hitag2'},1.0,is-a,hitag2 is an insecure stream cipher in that is has short key lengths and can be attacked by using expensive devices such as copacobana.,hitag2,insecure stream cipher,no
1067,30147060.0,"given the short length of hitag2's keys, this stream cipher has been considered insecure for some years, and as such it can be attacked by using expensive devices such as copacobana (guneysu et al., 2008) . in addition to that, hitag2 suffers from more elaborated cryptographic attacks (courtois et al., 2009; courtois et al., 2011; stembera and novotny, 2011;",{'copacobana'},1.0,is-a,hitag2 is an insecure stream cipher in that is has short key lengths and can be attacked by using expensive devices such as copacobana.,hitag2,insecure stream cipher,no
1068,29159423.0,"[18] presented a novel scheme for combining different modalities of information for egocentric action recognition. from the egocentric video, they extracted dense trajectories and a set of local descriptors across the trajectories.",{'egocentric action recognition'},0.0,,,,,
1069,6783800.0,"to handle with high and more uncertainty in the evaluation and selection processes, the problem is solved by using multi-criteria decision making technique with interval type-2 fuzzy sets. the study contributes the facility location selection literature by introducing the application of fuzzy topsis method with interval type-2 fuzzy sets.",{'type-2 fuzzy set'},0.0,,,,,
1070,6783800.0,"different from the location selection literature, the study employed multicriteria decision making technique with type-2 fuzzy sets during the analysis to handle the uncertainties. the literature has suggested type-2 fuzzy sets in the case of availability of more and high uncertainty.",{'type-2 fuzzy set'},0.0,,,,,
1071,6783800.0,"although this kind of problem has inherently more uncertainty, to the best of the authors' knowledge, there is no study applying type-2 fuzzy sets (t2fss) for a facility location selection problem. on the other hand, researchers 9 have highlighted that there have been a limited number of studies involving industrial applications of t2fss and there has been a need to resolve the problems that were solved by using type-1 fuzzy sets.",{'type-2 fuzzy set'},0.0,,,,,
1072,6783800.0,"on the other hand, researchers 9 have highlighted that there have been a limited number of studies involving industrial applications of t2fss and there has been a need to resolve the problems that were solved by using type-1 fuzzy sets. so, the motivation for conducting the study comes from the literature review indicating the availability and criticality high uncertainties on the location selection decision making process as well as the lack of studies using type-2 fuzzy sets to handle uncertainties and vagueness for solving the problems in the multiple industrial environments.",{'type-1 fuzzy set'},0.0,,,,,
1073,6783800.0,"briefly, the paper aims to solve multi-stage location selection problem by applying fuzzy multi-criteria decision making approach by using type-2 fuzzy sets. in this pursuit, fuzzy topsis (technique for order preference by similarity to ideal solution) approach with type-2 fuzzy sets, developed by chen and lee 10 is employed for a location selection problem.",{'type-2 fuzzy set'},0.0,,,,,
1074,39715157.0,"in [12] , safa et al. proposed a hierarchical routing algorithm which is called cbtrp. for the cbtrp, neighbor nodes self-organize into a cluster structure according to the corresponding trust value.",{'cbtrp'},1.0,type-of,"cbtrp is a type of hierarchical routing algorithm, where neighbor nodes self-organize into a cluster structure according to the corresponding trust value.",cbtrp,hierarchical routing algorithm,no
1075,39715157.0,"for the cbtrp, neighbor nodes self-organize into a cluster structure according to the corresponding trust value. to ensure the safety of data transmission, the cbtrp would send data to trust cluster head directly and apply directed diffusion.",{'cbtrp'},0.0,,,,,
1076,1231017.0,"in this paper we present a nave approach to tackle the problem of cross-lingual wsd and cross-lingual lexical substitution which correspond to the task #2 and #3 of the semeval-2 competition. we used a bilingual statistical dictionary, which is calculated with giza\+\+ by using the eu-roparl parallel corpus, in order to calculate the probability of a source word to be translated to a target word (which is assumed to be the correct sense of the source word but in a different language).",{'cross - lingual lexical substitution'},0.0,,,,,
1077,1231017.0,"it is claimed that wsd is essential for those applications that require of language comprehension modules such as search engines, machine translation systems, automatic answer machines, second life agents, etc. moreover, with the huge amounts of information in internet and the fact that this information is continuosly growing in different languages, we are encourage to deal with crosslingual scenarios where wsd systems are also needed.",{'machine translation system'},1.0,used-for,"wsd systems are used for applications that require language comprehension modules such as search engines, machine translation systems, automatic answer machines, second life agents, etc.",wsd system,"applications that require language comprehension modules such as search engines, machine translation systems, automatic answer machines, second life agents, etc",no
1078,1231017.0,,,,compare,"machine translation systems are like [search engines, automatic answer machines, second life agents] in that they require language comprehension modules.",machine translation system,"search engines, automatic answer machines, second life agents",no
1079,1231017.0,"moreover, with the huge amounts of information in internet and the fact that this information is continuosly growing in different languages, we are encourage to deal with crosslingual scenarios where wsd systems are also needed. despite the wsd task has been studied for a long time, the expected feeling is that wsd should be integrated into real applications such as mono and multi-lingual search engines, machine translation systems, automatic answer machines, etc (agirre and edmonds, 2006) .",{'wsd system'},0.0,,,,,
1080,1231017.0,"despite the wsd task has been studied for a long time, the expected feeling is that wsd should be integrated into real applications such as mono and multi-lingual search engines, machine translation systems, automatic answer machines, etc (agirre and edmonds, 2006) . different studies on this issue have demonstrated that those applications benefit from wsd, such as in the case of machine translation (chan et al., 2007; carpuat and wu., 2007) .","{'wsd task', 'machine translation system'}",1.0,is-a,machine translation is a real application that benefits from wsd.,machine translation,real application,no
1081,1231017.0,"on the other hand, lexical substitution (ls) refers to the process of finding a substitute word for a source word in a given sentence. the ls task needs to be approached by firstly disambiguating the source word, therefore, these two tasks (wsd and ls) are somehow related.",{'source word'},0.0,,,,,
1082,9723691.0,"the resource sharing hypothesis proposes a dynamic distribution of resources over a time span of up to 600 msec during the attentional blink. in contrast, the st 2 model argues that working memory encoding is serial during the attentional blink and that, due to joint consolidation, lag 1 is the only case where resources are shared.",{'attentional blink'},0.0,,,,,
1083,6162778.0,"deep generative models (dgms) characterize the distribution of observations with a multilayered structure of hidden variables under nonlinear transformations. among various deep learning methods, dgms are natural choice for those tasks that require probabilistic reasoning and uncertainty estimation, such as image generation [1] , multimodal learning [30] , and missing data imputation.",{'deep generative model'},1.0,is-a,"deep generative models (dgms) are a deep learning method that characterize the distribution of observations with a multilayered structure of hidden variables under nonlinear transformationsm and are a natural choice for those tasks that require probabilistic reasoning and uncertainty estimation, such as image generation, multimodal learning, and missing data imputation.",deep generative model,deep learning method,no
1084,6162778.0,,,,is-a,image generation is a task that requires probabilistic reasoning and uncertainty estimation.,image generation,task,no
1085,6162778.0,,,,compare,"image generation is like [multimodal learning, missing data imputation] in that they are tasks that require probabilistic reasoning and uncertainty estimation.",image generation,"multimodal learning, missing data imputation",no
1086,6162778.0,"for the arguably more challenging unsupervised learning, [5] presents a generative adversarial network (gan), which adopts a game-theoretical min-max optimization formalism. gan has been extended with success in various tasks [1, 21] .",{'generative adversarial network'},0.0,,,,,
1087,119105191.0,"bow-cnn (johnson and zhang, 2014) learns powerful embedding of small text regions by applying cnn to high-dimensional text data. the embedding of all regions are sent to one or multiple convolutional layers, a pooling layer and the output layer at the end.",{'cnn'},0.0,,,,,
1088,119105191.0,"bow-cnn (johnson and zhang, 2014) learns powerful embedding of small text regions by applying cnn to high-dimensional text data. the embedding of all regions are sent to one or multiple convolutional layers, a pooling layer and the output layer at the end.",{'cnn'},0.0,,,,,
1089,210157149.0,"in this article, we present an overview of the sparse vector transmission (svt), a scheme to transmit a short-sized information after the sparse transformation. we discuss basics of svt, two distinct svt strategies, viz., frequency-domain sparse transmission and sparse vector coding with detailed operations, and also demonstrate the effectiveness in realistic wireless environments.",{'svt'},1.0,is-a,"svt is the sparse vector transmission, that is a scheme that transmits a short-sized information after the sparse transformation. ",svt,sparse vector transmission,no
1090,210157149.0,our intent in this article is to introduce new type of short packet transmission scheme referred to as sparse vector transmission (svt). key idea of svt is to transmit the short-sized information after the sparse vector transformation.,{'svt'},1.0,type-of,svt is a type of short packet transmission scheme that transmits the short-sized information after the sparse vector transformation.,svt,short packet transmission scheme,no
1091,210157149.0,"further, svt can inherently improve the user identification quality and security. in a nutshell, svt is a viable solution for massive machine-type communication (mmtc) and urllc scenarios having many advantages over the conventional packet transmission mechanism.",{'svt'},1.0,type-of,svt is a type of solution that is used for massive machine-type communication (mmtc) and urllc scenarios having many advantages over the conventional packet transmission mechanism and it can inherently improve the user identification quality and security.,svt,solution,no
1092,496982.0,"in this paper, we propose a novel feature extraction algorithm called membership-degree preserving discriminant analysis (mpda) based on the fisher criterion and fuzzy set theory for face recognition. in the proposed algorithm, the membership degree of each sample to particular classes is firstly calculated by the fuzzy k-nearest neighbor (fknn) algorithm to characterize the similarity between each sample and class centers, and then the membership degree is incorporated into the definition of the between-class scatter and the within-class scatter.",{'fuzzy set theory'},0.0,,,,,
1093,496982.0,lpp is a linear algorithm and is able to generate effective maps for both training and test data points. some experiments have shown that lpp can be successfully applied in face recognition.,{'lpp'},1.0,is-a,lpp is a linear algorithm that is able to generate effective maps for both training and test data points and has been shown to be successfully applied in face recognition.,lpp,linear algorithm,no
1094,496982.0,,,,used-for,lpp can be used for face recognition.,lpp,face recognition,no
1095,496982.0,"owing to the success of lpp in face recognition, some improvements have been developed to overcome the limitations of lpp, such as unsupervised discriminant projection (udp) [9] , classcorrelation locality preserving projection [10] , supervised lpp [11] , marginal fisher analysis (mfa)","{'lpp', 'unsupervised discriminant projection'}",1.0,used-for,lpp is used for face recognition.,lpp,face recognition,no
1096,496982.0,,,,compare,unsupervised discriminant projection is like marginal fisher analysis in that they are used to overcome the limitations of lpp.,unsupervised discriminant projection,marginal fisher analysis,yes
1097,496982.0,"[9] , classcorrelation locality preserving projection [10] , supervised lpp [11] , marginal fisher analysis (mfa) [12] , discriminant locality preserving projection (dlpp)",{'marginal fisher analysis'},0.0,,,,,
1098,496982.0,"[12] , discriminant locality preserving projection (dlpp) [13] , local fisher linear discriminant analysis (lfda)",{'dlpp'},0.0,,,,,
1099,8798193.0,"although the pooled features can be directly used for classification, it has two drawbacks: (1) caused from the over-completeness and compositionality of rois in hrd, it tends to be highly correlated and redundant between the variables of pooled features; (2) for a hrd with large number of rois, it produces a huge number of variables in this raw feature representation and may obstruct large-scale image classification. motivated by the success of partial least squares (pls) in computer vision literature [17, 18] , we further employ the pls analysis for dimensionality reduction on the pooled features.","{'pool feature', 'large - scale image classification'}",0.0,,,,,
