,paper_id,sentence,forecite_concepts,is_relational,relation,formatted_statement,concept_a,concept_b,is_conceptb_forecite
412,,,,,used-for,recursive feature elimination is used to remove both irrelevant and redundant genes when searching for an optimal minimum subset of genes for a good classifier.,recursive feature elimination,remove both irrelevant and redundant genes when searching for an optimal minimum subset of genes for a good classifier,no
413,15269942.0,"since the within-class variance matrix in flda is singular when p  n -k, we propose a second gene selection method ""algorithm 2"" in such cases by introducing diana (divisive analysis) clustering algorithm (kaufman and rousseeuw, 1990) with (1-pearson correlation) as the distance measure. datta and datta (2003)",{'divisive analysis'},0.0,,,,,
414,43527733.0,"in multisequence alignment based tools, karect depicts excellent error correction rate whereas coral shows better execution time for all data sets. in hybrid based tools, jabba shows better error correction rate and execution time as compared to brownie.",{'karect'},1.0,is-a,karect is a technique used in multisequence alignment based tools which depicts excellent error correction rate.,karect,technique,no
415,43527733.0,,,,compare,karect is like coral in that they are both techniques used in multisequence alignment based tools.,karect,coral,no
416,43527733.0,"[7] hammer (2011), musket (2013), hector (2014) and racer (2013). these tools correct the errors on k-mer incidence.",{'musket'},1.0,is-a,musket is a tool which corrects the errors on k-mer incidence.,musket,tool,no
417,43527733.0,,,,compare,musket is like hammer in that they are both tools which correct the errors on k-mer incidence.,musket,hammer,no
418,43527733.0,,,,compare,musket is like hector in that they are both tools which correct the errors on k-mer incidence.,musket,hector,no
419,43527733.0,,,,compare,musket is like racer in that they are both tools which correct the errors on k-mer incidence.,musket,racer,no
420,43527733.0,"musket and racer are selected from the k-spectrum based category, coral and karect are selected from the multiple sequence alignment categories, and jabba and brownie are selected from the hybrid based category. these tools run on two different computing platforms.","{'musket', 'karect'}",0.0,,,,,
421,43527733.0,"the authors argued that lordec consumes less memory as compared to other tools and error correction rate is 99%. in fiona, used partial suffix array with hierarchical statically method to correct errors in sequencing reads.",{'lordec'},0.0,,,,,
422,15224188.0,"in order to reflect about these problems and to give a possible solution in a real case scenario, we will use a case study familiar in europe: the europeana collection 17 , i.e., the european digital library, a distributed access point to europe's multilingual cultural heritage in a digital form, containing an aggregated form of the content of several dozens of the main digital collections of digital heritage resources. in this paper, we describe some features of europeana and analyse the query results of the current implementation, proposing some reflections on the project in the current phase (section 2).",{'distribute access point'},0.0,,,,,
423,50338.0,"though broadband wireless access technology local multipoint distribution service (lmds) already exists at 28 ghz, it is still unused. this band has been considered as a potential candidate for 5g cellular frequency due to its low atmospheric absorption, and availability of high gain adaptive antennas [3] - [6] .",{'28 ghz'},0.0,,,,,
424,2783386.0,"stasis uses short vectors, looks at word-form rather than lemmata and includes function words, which are normally discarded by other measures. word similarities are computed using an edge-counting measure in a taxonomy and it makes use of word position.",{'word similarity'},1.0,is-a,word similarity is a parameter computed using an edge-counting measure in a taxonomy and it makes use of word position.,word similarity,parameter,no
425,17803220.0,"landay [8] integrated crosspad 1 with notepals but the system requires synchronization to upload notes. in addition, crosspad is not the best system for daily use in current japanese classrooms because of its size and weight.",{'notepal'},0.0,,,,,
426,38711627.0,"this paper presents a distributed cache replacement method based on tile sequence with spatiotemporal feature in access pattern. the method builds a lru stack to storage current hot tiles and their popularities based on the sequential feature when tiles are accessed, then structures tile sequence which embodies both temporal and spatial locality in hot-tile access; moreover, chooses a right tile sequence to be replaced.",{'spatiotemporal feature'},0.0,,,,,
427,8285853.0,"abstract-the information-theoretic capacity of multiple antenna systems was shown to be significantly higher than that of single antenna systems in rayleigh-fading channels. in an attempt to realize this capacity, foschini proposed the layered space-time architecture.",{'layer space - time architecture'},1.0,is-a,layered space-time architecture is a method proposed to realize the information-theoretic capacity of multiple antenna systems.,layered space-time architecture,method,no
428,10169638.0,"these algorithms have many applications in various fields such as genetics (pritchard et al., 2000) , image analysis (fei-fei and perona, 2005; russell et al., 2006; barnard et al., 2003) , survey data processing (erosheva et al., 2007) and social media analysis (airoldi et al., 2007) . most current topic modelling methods are based on the well-known 'bag-of-words' representation; in this approach, a document is represented simply as a bag of words, where words counts are preserved but their order in the original document is ignored.",{'perona'},0.0,,,,,
429,10169638.0,"at the heart of lda-gn is what we call a 'gibbs-newton' (gn) approach for learning the hyper-parameters of a multivariate polya distribution. within lda-gn, the role of gn is to learn the parameters for what amounts to the combination of two distinct multivariate polya distributed data streams that are assumed in the lda model.",{'lda model'},0.0,,,,,
430,57487772.0,"chaos theory is applied in pso algorithm to improve the diversity of the population and particle traversal search, which can effectively improve the pso algorithm convergence speed and accuracy., and svm mode is optimized. through a specific example, its results demonstrate that the chaos pso has a good high efficiency and higher accuracy than the traditional pso applied in svm classifier.",{'pso algorithm'},1.0,is-a,"pso algorithm is method which applies chaos theory to improve the diversity of the population and particle traversal search, which can effectively improve the pso algorithm convergence speed and accuracy.",pso algorithm,method,no
431,67750685.0,we prove that our abstract solution generalises over paxos as well as the fast paxos and flexible paxos algorithms. the surprising result of this analysis is a substantial weakening to the quorum requirements of these widely studied algorithms.,"{'fast paxos', 'paxos'}",0.0,,,,,
432,67750685.0,"furthermore, paxos is usually implemented in the form of multi-paxos, which establishes one participant as the master, introducing a performance bottleneck and increasing latency as all decisions are forwarded via the master. given these limitations, many production systems often opt to sacrifice strong consistency guarantees in favour of performance and high availability [7, 3, 18] .",{'paxos'},0.0,,,,,
433,67750685.0,"whilst compromise is inevitable in practical distributed systems [10] , paxos offers just one point in the space of possible trade-offs. in response, this paper aims to improve performance by offering a generalised solution allowing engineers the flexibility to choose their own trade-offs according to the needs of their particular application and deployment environment.",{'paxos'},0.0,,,,,
434,1986779.0,"for example, pamas [21] presents a mac protocol that conserves energy by turning off radios overhearing cross traffic. an adaptive fidelity energy-conservation algorithm (afeca) that gives a trade off between energy dissipation and data delivery quality according to application requirements is presented in [26] .",{'afeca'},1.0,is-a,afeca is a method that gives a trade off between energy dissipation and data delivery quality according to application requirements.,afeca,method,no
435,16988454.0,"later, mimno et al. compared several language models and proposed author-persona-topic model [19] .",{'language model'},0.0,,,,,
436,14668239.0,"the model assumes that learning of internal (hidden) generative models, which can predict the future and evaluate the precision of that prediction, is of central importance for information extraction. furthermore, the model makes a bridge to goal-oriented systems and builds upon the structural similarity between the architecture of a robust controller and that of the hippocampal entorhinal loop.",{'structural similarity'},0.0,,,,,
437,14668239.0,"connections to reinforcement learning are also established: both the control network, and the network with a hidden model converge to (near) optimal policy under suitable conditions. falsifying predictions, including the role of the feedback connections between neocortical areas are made.",{'reinforcement learning'},0.0,,,,,
438,204106466.0,"in wrapper approaches, using a classification algorithm to assess the candidate channel subsets generated by a search algorithm [11] . for instance, feature selection combined with classification algorithms such as svm classifiers [18] .",{'wrapper approach'},0.0,,,,,
439,9520021.0,"moreover, the implementation of the improved translucent volume rendering method (itvrm) integrating the ivrom model, shearwarp and preintegrated volume rendering algorithm is described, in which the aliasing and staircase effects resulting from undersampling in shear-warp, are avoided by the preintegrated volume rendering technique. this study demonstrates the superiority of the proposed method.",{'shear - warp'},0.0,,,,,
440,1347207.0,the ctl* tableau of [8] builds upon a previous tableau for bundled full computation tree logic (bctl*) [7] .,{'ctl * tableau'},1.0,is-a,ctl* tableau is an extension of a previous tableau for bundled full computation tree logic.,ctl* tableau,extension of a previous tableau for bundled full computation tree logic,no
441,1347207.0,"in this paper we propose a rooted variant 2 of the tableau for bctl* in [7] . although, bctl* has some advantages over ctl* the primary reason we chose to implement a bctl* tableau is that the ctl* tableau of [8] is built from the much simpler bctl* tableau of [7] .",{'ctl * tableau'},0.0,,,,,
442,44182356.0,"this concept is a generalization of the concept of delone (r, r)-systems. in light of the developments in the local theory for crystals that occurred since 1976 and demands in chemistry and crystallography, we believe the local theory for t-bonded sets deserves to be developed to describe materials whose atomic structures is multi-regular ""microporous"" point set.",{'delone'},0.0,,,,,
443,8954251.0,"content-based filtering is the most common type of event filtering in publish/subscribe systems, resulting in a ""contentbased publish/subscribe system"". it views each event notification message as a set of attribute/value pairs, whose values may be examined according to subscriber-given conditions.",{'publish / subscribe system'},0.0,,,,,
444,166228387.0,recently subspace codes have been widely investigated by many authors and different approaches of constructing constant dimension codes have been considered. this paper deals with cdc and it is organized as follows.,{'constant dimension code'},0.0,,,,,
445,11341482.0,"according to our experience, even the 'package-specific-naming' solution may lead to different naming schemes if the atom names were dissimilar before the conversion, or if the ligands come from smiles representations. to avoid these difficulties in assigning equivalent interactions, docking assessments (michino et al., 2009 ) required modelers to submit data in a rigid protein data bank (pdb) template format with defined names and sequential positions of atoms.",{'smile representation'},0.0,,,,,
446,49557232.0,"abstract inductive wireless power transfer (ipt) is a promising technology for remote powering of a wide variety of applications of electronic devices. to design ipt systems with the highest power transfer efficiency and the maximal robustness to coupling factor variations between transmitter and receiver of printed spiral coils (pscs), high quality factors (q-factor) of the utilized pscs are required.",{'print spiral coil'},0.0,,,,,
447,9215048.0,"the simulator includes a simple web-browser interface for specifying and refining a target reaction network as well as visualization tools to represent the network's behavior. the simulator is verified as rapidly solving in seconds (with benchmarks relative to gepasi) some classic biological circuits like the lac operon and qa gene cluster as well as a new circuit, the repressilator, with oscillatory behavior.",{'gepasi'},0.0,,,,,
448,9215048.0,"like gepasi (mendes, 1997) , kinsolver is not constrained by the size of the reaction network and has a menu-based interface, but it differs in the kinds of numerical integration tools available and in having a web interface to give it platform independence. there are three features that separate kinsolver from most other simulators, its platform independence, flexibility in solution procedures, and its capability to simulate efficiently large (10 4 -10 5 ) ensembles of models.",{'gepasi'},1.0,is-a,gepasi is a simulator that is not constrained by the size of the reaction network and has a menu-based interface.,gepasi,simulator,no
449,9215048.0,,,,compare,gepasi is like kinsolver in that they are both simulators that are not constrained by the size of the reaction network and have a menu-based interface.,gepasi,kinsolver,no
450,9215048.0,"some important real examples are used to evaluate the solution procedures of the underlying coupled nonlinear differential equations relative to gepasi (mendes, 1997 ) with a particular focus on simulating model ensembles. the paper concludes with limitations of kinsolver and some needed extensions to the modeling approach, which kinsolver implements.",{'gepasi'},0.0,,,,,
451,86650132.0,"compared with the battery powered electric vehicles, fuel cell vehicles have great superiorities in energy efficiency, endurance mileage, charging speed and climate tolerance. the energy conversion efficiency of the fuel cell vehicle is not limited by carnot cycle, and its energy conversion efficiency can be as high as 60%~70%, which is nearly twice of the ordinary internal combustion engine.",{'energy conversion efficiency'},1.0,is-a,energy conversion efficiency is a measure of energy efficiency for fuel cell vehicles.,energy conversion efficiency,measure of energy efficiency,no
452,35320757.0,[1] and wyner-ziv (wz) [2] .,{'wyner - ziv'},0.0,,,,,
453,35320757.0,brites et al. [3] have stated that reducing the decoder complexity and improving the rd performance can be done by optimizing channel coding techniques and improving the quality of the si.,{'brite'},0.0,,,,,
454,35320757.0,the lanczos interpolation has been implemented for optimizing decomposition based on lossless compression of biomedical images [13] and segmentation of ultrasound breast phantom data [14] . the bicubic interpolation also has been applied for image zooming [15] .,{'bicubic interpolation'},1.0,used-for,bicubic interpolation is used for image zooming.,bicubic interpolation,image zooming,no
455,35320757.0,,,,compare,bicubic interpolation is like lanczos interpolation in that they are both used for image zooming.,bicubic interpolation,lanczos interpolation,no
456,52047968.0,"a variety of clustering algorithms based on moea are emerging [16] , [17] . mock [18] is a typical multiobjective evolutionary clustering algorithm, was proposed by handl and this method applies compactness and connectedness as two objective functions.",{'moea'},0.0,,,,,
457,52047968.0,mopso [21] uses connectivity and cohesion as two objective functions to find the best clustering result. msfca utilizes the global fuzzy compactness and fuzzy separation among the clusters as objective functions and gets the best clustering result in image segmentation [22] .,{'mopso'},1.0,is-a,mopso is a method that uses connectivity and cohesion as two objective functions to find the best clustering result.,mopso,method,no
458,52047968.0,"the first one is the global weight clustering coefficient and the second one is a combination of the classical knn and the minimal cut. however, this approach has the same memory usage problem than spectral clustering.",{'spectral clustering'},1.0,is-a,spectral clustering is an approach that has a memory usage problem.,spectral clustering,approach,no
459,52047968.0,"this paper has two contributions. the first is to combine various distance measures into a clustering algorithm, compactness is the only factor to be considered for objective function setting, we call it multiobjective evolutionary clustering based on combining multiple distance measures(moecdm).",{'evolutionary clustering'},0.0,,,,,
460,58981918.0,"the focus has been on increasing accuracy, in particular for image, speech, and recently text tasks, where deep convolutional neural networks (cnns) are applied. the resulting networks often include millions to billions parameters.",{'deep convolutional neural network'},0.0,,,,,
461,58981918.0,"it is known that dropout improves the test accuracy compared to standard regularizers such as l 1 (tibshirani, 1996) and l 2 (srivastava et al., 2014) . wager et al.",{'dropout'},1.0,compare,dropout is like l 1 except that it has improved test accuracy.,dropout,l 1,no
462,58981918.0,,,,compare,dropout is like l 2 except that it has improved test accuracy.,dropout,l 2,no
463,58981918.0,(2013) proved that dropout is equivalent to an l 2 -type regularizer applied after scaling the inputs. heuristic regularization is not limited to dropout only.,{'dropout'},0.0,,,,,
464,44083468.0,"similarly, bubble rap proposed in [20] combines the betweenness centrality in the ego network with social communities to increase the data forwarding performance in msns. gao et al.",{'bubble rap'},1.0,,bubble rap is a method that combines the betweenness centrality in the ego network with social communities to increase the data forwarding performance in msns.,bubble rap,method,no
465,67872076.0,"based on the construction of wind power-pumped storage combined generator set by using water resources, combined with the power generation of a thermal power unit, a scheduling strategy based on the dynamic kriging model for the integrated strategy of output planning and the economic operation of a wind power-pumped storage-thermal power combined system is proposed. the strategy uses the hypercube sampling method and the particle swarm optimization algorithm after improving the inertia weight to solve the model.",{'inertia weight'},0.0,,,,,
466,1929070.0,"if the measurement uncertainty follows a gaussian probability distribution and the features correspondence between frames is not available, iterative closest point (icp) algorithm can be used to find the translation and rotation between two different frames [1] . if there exists correspondence between different frames, least squares techniques with tools such as: singular value decomposition (svd) and unit quaternion, can be applied to estimate the rigid transformation by minimizing the distance between corresponding points [2] , [10] .","{'icp', 'iterative close point'}",1.0,used-for,icp is used to find the translation and rotation between two different frames when the measurement uncertainty follows a gaussian probability distribution and the features correspondence between frames is not available.,icp,find the translation and rotation between two different frames,no
467,1436159.0,"we map the descriptor vectors into the hamming space in which the hamming metric is used to compare the resulting representations. this way, we reduce the size of the descriptors by representing them as short binary strings and learn descriptor invariance from examples.",{'hamming space'},0.0,,,,,
468,1436159.0,"while helpful, this approach is usually not sufficient to produce truly short descriptors without loss of matching performance. another class [9] , [10] , [11] , [12] takes advantage of training data to learn short binary codes whose distances are small for positive training pairs and large for others.",{'short binary code'},0.0,,,,,
469,1436159.0,"this maps the data into a space of binary strings, greatly reducing their size on the one hand and simplifying their similarity computation (now becoming the hamming metric, which can be computed very efficiently on modern cpus) on the other. another class of locality-sensitive hashing (lsh) techniques and their variants [9] , [13] encode similarity of data points as the collision probability of their binary codes.",{'locality - sensitive hashing'},1.0,is-a,locality-sensitive hashing is a technique used to encode similarity of data points as the collision probability of their binary codes.,locality-sensitive hashing,technique,no
470,16610270.0,"depending on the sources availability and the platform needs, different services are published in and withdrawn from the platform service registry. they are then opportunistically used by the pervasive applications, coded in ipojo.",{'ipojo'},0.0,,,,,
471,9807808.0,in section 3 we demonstrate how units can assist in identifying spreadsheet errors. the header inference framework and the individual spatial-analysis algorithms are described in section 4.,{'spreadsheet error'},0.0,,,,,
472,26259894.0,"given only a total energy reading, such as that collected from a residential meter, energy disaggregation strives to discover the consumption of individual appliances. existing disaggregation algorithms are computationally inefficient and rely heavily on high-resolution ground truth data.",{'energy disaggregation'},1.0,used-for,"energy disaggregation is used to discover the consumption of individual appliances given only a total energy reading, such as that collected from a residential meter.",energy disaggregation,discover the consumption of individual appliances,no
473,26259894.0,"existing disaggregation algorithms are computationally inefficient and rely heavily on high-resolution ground truth data. we introduce a probabilistic framework which infers the energy consumption of individual appliances using a hinge-loss markov random field (hl-mrf), which admits highly scalable inference.",{'hinge - loss markov random field'},0.0,,,,,
474,26259894.0,"smart meters offer a unique opportunity to gather real-time data, learn energy consumption patterns, and ultimately offer actionable insights to consumers. energy disaggregation (also referred to as non-intrusive load monitoring (nilm)) is the process of determining the energy consumption of individual appliances, given only an aggregated energy reading.","{'energy disaggregation', 'nilm'}",1.0,is-a,"energy disaggregation is a process of determining the energy consumption of individual appliances (also referred to as nilm), given only an aggregated energy reading.",energy disaggregation,process,yes
475,26259894.0,"to formulate the inference task we use a hinge-loss markov random field (hl-mrf) [bach et al., 2015] , which allows a flexible probabilistic formulation and admits efficient inference.",{'hinge - loss markov random field'},1.0,used-for,hinge-loss markov random field is used to formulate inference tasks.,hinge-loss markov random field,formulate inference tasks,no
476,26259894.0,,,,is-a,hinge-loss markov random field is an approach which allows a flexible probabilistic formulation and admits efficient inference.,hinge-loss markov random field,approach,no
477,1093643.0,"to avoid mistreating all unknown actors, they proposed the use of free but unreplaceable (once in a lifetime) pseudonyms, which a central authority certifies through blind signature. a couple of years later, doucer put similar ideas to test in p2p networks.",{'blind signature'},0.0,,,,,
478,1093643.0,"however, their approach suffers from ""sybil attacks"". they thus recently enhanced the original trust model so that trust updates internalize the costs of sybil attacks [17] .",{'sybil attack'},0.0,,,,,
479,53250547.0,an image-based visual servo (ibvs) was implemented in [8] to help locating the position of the targeted object. feature models are used in [9] to find the position of known targets.,{'image - base visual servo'},1.0,used-for,image-based visual servo is used to help locate the position of a targeted object.,image-based visual servo,help locate the position of a targeted object,no
480,28699619.0,"[5] use constrained bayesian optimization to tune dnn model hyper-parameters using improvement in terms of wer of the validation set with rtf as the constraint. [6] perform a scalarization of wer and real time factor (rtf) and perform a variation of co-ordinate descent to tune decoder hyper-parameters, but only deal with continuous hyper-parameters.",{'continuous hyper - parameter'},0.0,,,,,
481,15964245.0,"we apply techniques from asynchronous circuit design, based on signal transition graphs (stgs), to modelling, visualising and analysing grns. stgs are a petri net based model that has been extensively used in asynchronous circuit design.",{'signal transition graph'},0.0,,,,,
